{
  "$schema": "../../schema/orb.schema.json",
  "specVersion": "0.1",
  "name": "local-model",
  "version": "1.0.0",
  "kind": "model",
  "description": "An open-weights model served on this machine. Data never leaves the device.",
  "model": { "provider": "ollama", "runtime": "local", "dataBoundary": "local" },
  "access": { "approval": "none" }
}
